title,authors,venue,abstract,impact,links
"Branch-Commit-Validate: A Git-Inspired Workflow for Autonomous Red-Team Agents","C. Shringi*, A. Hillel-Tuch, S. Rizwan* (*Student Researchers)","World Congress in Computer Science, Computer Engineering, & Applied Computing (CSCE) 路 2025","Novel workflow framework for autonomous red-team agents inspired by Git version control, enabling structured offensive security testing and validation processes. Research collaboration with student researchers advancing autonomous security testing methodologies.",""," Google Scholar|https://scholar.google.com/citations?hl=en&user=yxEpRBIAAAAJ"
"Physical Memory Attacks and a Memory Safe Management System for Memory Defense","Alon Hillel-Tuch, Aspen Olmstead","Springer Transactions on Computational Science & Computational Intelligence 路 March 2024 (Extended from CSCE 2022)","Extended journal version presenting novel physical memory attack vectors and proposing a memory-safe management system designed to defend against both traditional and emerging memory-based attacks in modern computing systems. Includes open-source proof-of-concept implementation released for research and industry adoption.",""," Google Scholar|https://scholar.google.com/citations?hl=en&user=yxEpRBIAAAAJ"
"Technical Book Reviewer: Security-Driven Software Development","Author: Aspen Olmsted 路 Reviewer: Alon Hillel-Tuch","Packt Publishing 路 2024","Technical book reviewer for ""Security-Driven Software Development: Learn to analyze and mitigate risks in your software projects."" Provided expert review on security practices, threat modeling, and secure development methodologies for comprehensive software security guide.",""," View Book|https://www.packtpub.com/product/security-driven-software-development/9781835460825"
"Priority Based Soft-Solution for Operating System Integrity Due To Randomized Hardware Faults At The Transistor Level","Alon Hillel-Tuch, Aspen Olmsted","Conference Paper 路 December 2021","Proposes a priority-based software solution to maintain operating system integrity when facing randomized hardware faults at the transistor level, addressing critical reliability challenges in modern computing systems.",""," ResearchGate|https://www.researchgate.net/profile/Alon-Hillel-Tuch"
"Data Siphoning Through Advanced Persistent Transmission Attacks At The Physical Layer","Alon Hillel-Tuch","SSRN Electronic Journal 路 May 2021","This paper explores data exfiltration dynamics across complex networked systems, examining how sophisticated attackers establish persistent transmission flows at the physical layer that evade traditional network security detection mechanisms. Focus on nation-state level threats and defense strategies."," Impact: 480+ downloads 路 1,300+ abstract views on SSRN 路 Multiple citations"," Read Paper (SSRN)|https://papers.ssrn.com/sol3/papers.cfm?abstract_id=3890371:: Google Scholar|https://scholar.google.com/citations?hl=en&user=yxEpRBIAAAAJ"
"Implementation of Crowdfunding in the United States: Regulatory and Market Challenges","Alon Hillel-Tuch, Jed Cohen","Conference Paper 路 2014","Analysis of crowdfunding platform implementation challenges following the JOBS Act passage, examining regulatory compliance frameworks, market structure evolution, and investor protection mechanisms in emerging equity crowdfunding markets.",""," Google Scholar|https://scholar.google.com/citations?hl=en&user=yxEpRBIAAAAJ"
"Crowdfunding Platform Architecture and Regulatory Frameworks","Alon Hillel-Tuch, Jed Cohen","Conference Paper 路 2012","Explores technical and regulatory architectures for crowdfunding platforms, proposing frameworks for balancing innovation, market efficiency, and compliance with emerging securities regulations under the JOBS Act.",""," Google Scholar|https://scholar.google.com/citations?hl=en&user=yxEpRBIAAAAJ"
"Developing Focal Point Networks for State-Centered Genocide Prevention","Alon Hillel-Tuch","SSRN Electronic Journal 路 May 2011","Examines the development of focal point networks as mechanisms for state-centered genocide prevention, exploring coordination strategies and institutional frameworks for early intervention.",""," Read Paper (SSRN)|https://papers.ssrn.com/sol3/cf_dev/AbsByAuth.cfm?per_id=1820862"
